{
  "skillId": "venn-diagrams-sets",
  "summary": "For two overlapping groups, the total counts everyone once, so the overlap must be subtracted back out after adding the group sizes.",
  "formulas": [
    { "name": "Two-set overlap formula", "expression": "|A \\cup B| = |A| + |B| - |A \\cap B|" },
    { "name": "Three-set overlap formula", "expression": "|A\\cup B\\cup C| = |A|+|B|+|C|-|A\\cap B|-|A\\cap C|-|B\\cap C|+|A\\cap B\\cap C|" }
  ],
  "explanation": "When two groups overlap, simply adding their sizes double-counts the people in both — the overlap formula corrects for this by subtracting the intersection once: \\(|A\\cup B|=|A|+|B|-|A\\cap B|\\). A Venn diagram makes this visual: the two circles' overlap region should only be counted once in the total. \"Only A\" (not B) is \\(|A|-|A\\cap B|\\); \"neither A nor B\" is the total minus \\(|A\\cup B|\\). For three overlapping groups, the formula gets more complex (add all three, subtract all three pairwise overlaps, add back the triple overlap) because the triple-overlap region gets subtracted too many times in the pairwise step and needs to be restored."
}
